{
  "$schema": "https://json-schema.org/draft/2020-12/schema",
  "$id": "https://cutbridge.local/schema/cutbridge-manifest.schema.json",
  "title": "CutBridge Manifest",
  "type": "object",
  "required": [
    "schema",
    "schema_version",
    "cutbridge_version",
    "project",
    "episode",
    "scene",
    "cut",
    "take",
    "version",
    "fps",
    "resolution",
    "frames",
    "passes"
  ],
  "properties": {
    "schema": {"const": "cutbridge-manifest"},
    "schema_version": {"type": "integer", "minimum": 1},
    "cutbridge_version": {"type": "string"},
    "project": {"type": "string"},
    "episode": {"type": "string"},
    "scene": {"type": "string"},
    "cut": {"type": "string"},
    "take": {"type": "string"},
    "version": {"type": "integer", "minimum": 1},
    "version_label": {"type": "string"},
    "package_name": {"type": "string"},
    "fps": {"type": "number", "exclusiveMinimum": 0},
    "resolution": {
      "type": "object",
      "required": ["width", "height"],
      "properties": {
        "width": {"type": "integer", "minimum": 1},
        "height": {"type": "integer", "minimum": 1},
        "pixel_aspect": {"type": "number", "exclusiveMinimum": 0}
      }
    },
    "frames": {
      "type": "object",
      "required": ["start", "end", "count"],
      "properties": {
        "start": {"type": "integer", "minimum": 0},
        "end": {"type": "integer", "minimum": 0},
        "count": {"type": "integer", "minimum": 1}
      }
    },
    "camera": {"type": ["string", "null"]},
    "source_blend": {"type": ["string", "null"]},
    "passes": {
      "type": "array",
      "minItems": 1,
      "items": {
        "type": "object",
        "required": ["name", "path", "sequence_pattern"],
        "properties": {
          "name": {"type": "string"},
          "path": {"type": "string"},
          "sequence_pattern": {"type": "string"},
          "required": {"type": "boolean"}
        }
      }
    },
    "folders": {
      "type": "object",
      "properties": {
        "render": {"type": "string"},
        "preview": {"type": "string"},
        "camera": {"type": "string"}
      }
    },
    "ae": {
      "type": "object",
      "properties": {
        "comp_name": {"type": "string"},
        "layer_order": {
          "type": "array",
          "items": {"type": "string"}
        }
      }
    },
    "studio_preset": {
      "type": "object",
      "required": ["mode", "schema", "schema_version", "id", "name"],
      "properties": {
        "mode": {"enum": ["manual", "default", "custom"]},
        "schema": {"const": "cutbridge-studio-preset"},
        "schema_version": {"const": 1},
        "id": {"type": "string"},
        "name": {"type": "string"}
      },
      "additionalProperties": false
    }
  },
  "additionalProperties": true
}
