{
  "schema": "cutbridge-manifest",
  "schema_version": 1,
  "cutbridge_version": "0.2.5",
  "project": "S14B",
  "episode": "EP01",
  "scene": "SC001",
  "cut": "C001",
  "take": "T01",
  "version": 2,
  "version_label": "V002",
  "package_name": "S14B_EP01_SC001_C001_T01_V002",
  "fps": 24.0,
  "resolution": {
    "width": 960,
    "height": 540,
    "pixel_aspect": 1.0
  },
  "frames": {
    "start": 1,
    "end": 12,
    "count": 12
  },
  "camera": "CAM_MAIN",
  "source_blend": "S14B_FX01_v002.blend",
  "passes": [
    {
      "name": "BEAUTY",
      "path": "render/beauty",
      "sequence_pattern": "C001_BEAUTY_####.png",
      "required": true,
      "image_format": "PNG"
    },
    {
      "name": "LINE",
      "path": "render/line",
      "sequence_pattern": "C001_LINE_####.png",
      "required": false,
      "image_format": "PNG"
    }
  ],
  "folders": {
    "render": "render",
    "preview": "preview",
    "camera": "camera"
  },
  "ae": {
    "comp_name": "C001_COMP",
    "layer_order": [
      "BEAUTY",
      "LINE"
    ]
  },
  "studio_preset": {
    "mode": "custom",
    "schema": "cutbridge-studio-preset",
    "schema_version": 1,
    "id": "s14b-fx01",
    "name": "S14B FX01 (BEAUTY required, LINE optional)"
  }
}